[
    {
        "add-to-mmo": false,
        "address-type-from": "<redacted-address>",
        "address-type-to": "<redacted-address>",
        "barcode": "<redacted-barcode>",
        "batch-category": "COMBINED",
        "batch-name": "<redacted-batch>",
        "batch-status": "CREATED",
        "completeness-checking": false,
        "delivery-time": {
            "max-days": 45,
            "min-days": 43
        },
        "delivery-to-door": false,
        "easy-return-recipient-payment": false,
        "forbidden-esp": false,
        "given-name": "<redacted-name>",
        "ground-rate": 64590,
        "ground-rate-with-vat": 78800,
        "ground-rate-wo-vat": 64590,
        "house-from": "<redacted-value>",
        "house-to": "<redacted-value>",
        "id": 0,
        "in-mmo": false,
        "index-from": "603000",
        "index-to": 685000,
        "is-dogovor": 0,
        "legal-hid": "<redacted-id>",
        "mail-category": "ORDINARY",
        "mail-direct": 643,
        "mail-rank": "WO_RANK",
        "mail-type": "POSTAL_PARCEL",
        "manual-address-input": false,
        "mass": 1000,
        "mass-rate": 64590,
        "mass-rate-with-vat": 78800,
        "mass-rate-wo-vat": 64590,
        "middle-name": "<redacted-name>",
        "order-num": "<redacted-order>",
        "payment-method": "CASHLESS",
        "place-from": "г Нижний Новгород",
        "place-to": "г. Магадан",
        "pochtaid-hid": "2488136",
        "postmarks": [
            "NONSTANDARD"
        ],
        "postoffice-code": "109012",
        "pre-postal-preparation": false,
        "prepayment-return": false,
        "recipient-name": "<redacted-name>",
        "region-from": "обл Нижегородская",
        "region-to": "обл. Магаданская",
        "renewal-shelf-life": false,
        "returned-partial": false,
        "str-index-to": "685000",
        "street-from": "<redacted-address>",
        "street-to": "<redacted-address>",
        "surname": "<redacted-name>",
        "tariff-count": 1,
        "tariff-type": "MASS",
        "tel-address": 0,
        "tel-address-from": 0,
        "total-rate-wo-vat": 64590,
        "total-vat": 14210,
        "track-by-group": 0,
        "transport-type": "SURFACE",
        "unloading": false,
        "version": 1,
        "weight-pay": 1000,
        "with-client-return": false,
        "with-discount": false
    }
]
